{
  "asOf": "2026-08-06T12:00:00.000Z",
  "project": {
    "id": "project-1",
    "name": "Example Product",
    "url": "https://linear.app/example/project/demo",
    "projectStatus": {
      "id": "project-status-in-progress",
      "name": "In Progress",
      "category": "in-progress"
    },
    "lifecycle": {
      "mode": "continuous"
    },
    "priority": "high",
    "lead": "Product Lead",
    "startDate": "2026-08-01",
    "targetDate": "2026-09-15",
    "latestUpdate": {
      "health": "at-risk",
      "summary": "Analytics naming still blocks final verification.",
      "createdAt": "2026-08-06T10:00:00.000Z"
    }
  },
  "initiatives": [
    {
      "key": "demo.strategy.activation",
      "name": "Improve product activation",
      "status": "active",
      "priority": "high",
      "owner": "CPO",
      "targetDate": "2026-12-31",
      "url": "https://linear.app/example/initiative/activation"
    }
  ],
  "milestones": [
    {
      "key": "demo.milestone.onboarding",
      "name": "Onboarding release",
      "targetDate": "2026-08-20",
      "url": "https://linear.app/example/milestone/onboarding"
    }
  ],
  "issues": [
    {
      "key": "demo.outcome.onboarding",
      "type": "outcome",
      "title": "Improve onboarding",
      "status": "In Progress",
      "priority": "high",
      "ownerRole": "tech-lead",
      "reviewerRole": "cpo",
      "milestoneKey": "demo.milestone.onboarding",
      "estimate": 3
    },
    {
      "key": "demo.task.ui",
      "type": "task",
      "title": "Implement onboarding UI",
      "status": "Ready",
      "priority": "high",
      "ownerRole": "software-engineer",
      "reviewerRole": "qa",
      "assignee": "Engineer A",
      "cycleName": "Cycle 32",
      "dueDate": "2026-08-15",
      "estimate": 5,
      "milestoneKey": "demo.milestone.onboarding",
      "url": "https://linear.app/example/issue/EXAMPLE-2"
    },
    {
      "key": "demo.task.copy",
      "type": "task",
      "title": "Write onboarding copy",
      "status": "In Review",
      "priority": "normal",
      "ownerRole": "content-writer",
      "reviewerRole": "content-director",
      "estimate": 2,
      "milestoneKey": "demo.milestone.onboarding"
    },
    {
      "key": "demo.task.tests",
      "type": "task",
      "title": "Verify onboarding analytics",
      "status": "Blocked",
      "priority": "normal",
      "ownerRole": "qa",
      "reviewerRole": "tech-lead",
      "estimate": 3,
      "blocker": { "neededFrom": "CPO" },
      "relations": { "blockedByKeys": ["demo.decision.metric"] },
      "milestoneKey": "demo.milestone.onboarding"
    },
    {
      "key": "demo.task.brief",
      "type": "task",
      "title": "Approve product brief",
      "status": "Done",
      "priority": "high",
      "ownerRole": "cpo",
      "reviewerRole": "tech-lead",
      "estimate": 1,
      "milestoneKey": "demo.milestone.onboarding"
    },
    {
      "key": "demo.decision.metric",
      "type": "decision",
      "title": "Choose activation metric",
      "status": "Refinement",
      "priority": "normal",
      "ownerRole": "cpo",
      "reviewerRole": "tech-lead",
      "estimate": 1
    }
  ]
}
